{"identity":{"probe_revision":"blizzard.anchor-path.0.1","report_id":"synthetic.path.report.001","status":"anchor_path_observed_pending_review"},"integrity":{"hash_algorithm":"sha256","report_sha256":"4c705852e7aa5c18d064cc1ccbbb49073926eaed8d9e97fa98b2046c9229965d"},"paths":{"anchored_count":2,"carrier_count":3,"signatures":[{"depth":4,"occurrences":1,"tags":["article","div","section","div"]},{"depth":4,"occurrences":1,"tags":["article","section","div","div"]}],"unanchored_count":1},"schema_version":"0.1","source":{"byte_count":247,"content_sha256":"7a8a41d94afd87bf5b8993866e16d0c5986b8de5c8c2364c4a511df07d23fea1","receipt_id":"synthetic.path.receipt.001","receipt_sha256":"628e135e92cd35fe7dff93276839ff4ff9eb5d5b8dcb7b4855b4524c95186af9"}}
